Year,CVE_ID,CVSS_Score,RAG,Matching_CVE_ID,Matching_Description,Match_Found
2020,CVE-2020-6100,9.9,"An exploitable memory corruption vulnerability exists in AMD atidxx64.dll 26.20.15019.19000 graphics driver. A specially crafted pixel shader can cause memory corruption vulnerability. An attacker can provide a specially crafted shader file to trigger this vulnerability. This vulnerability potentially could be triggered from guest machines running virtualization environments (ie. VMware, qemu, VirtualBox etc.) in order to perform guest-to-host escape - as it was demonstrated before (TALOS-2018-0533, TALOS-2018-0568, etc.). Theoretically this vulnerability could be also triggered from web browser (using webGL and webassembly). This vulnerability was triggered from HYPER-V guest using RemoteFX feature leading to executing the vulnerable code on the HYPER-V host (inside of the rdvgm.exe process).",CVE-2024-6100,Type Confusion in V8 in Google Chrome prior to 126.0.6478.114 allowed a remote attacker to execute arbitrary code via a crafted HTML page. (Chromium security severity: High),TRUE
2020,CVE-2020-6284,9,"SAP NetWeaver (Knowledge Management), versions - 7.30, 7.31, 7.40, 7.50, allows the automatic execution of script content in a stored file due to inadequate filtering with the accessing user's privileges. If the accessing user has administrative privileges, then the execution of the script content could result in complete compromise of system confidentiality, integrity and availability, leading to Stored Cross Site Scripting.",CVE-2024-6284,"In  https://github.com/google/nftables  IP addresses were encoded in the wrong byte order, resulting in an nftables configuration which does not work as intended (might block or not block the desired addresses).
This issue affects:  https://pkg.go.dev/github.com/google/nftables@v0.1.0 
The bug was fixed in the next released version:  https://pkg.go.dev/github.com/google/nftables@v0.2.0",TRUE
2020,CVE-2020-12830,9.8,Addressed multiple stack buffer overflow vulnerabilities that could allow an attacker to carry out escalation of privileges through unauthorized remote code execution in Western Digital My Cloud devices before 5.04.114.,CVE-2024-12830,"Arista NG Firewall custom_handler Directory Traversal Remote Code Execution Vulnerability. This vulnerability allows remote attackers to execute arbitrary code on affected installations of Arista NG Firewall. Authentication is not required to exploit this vulnerability.
The specific flaw exists within the implementation of the custom_handler method. The issue results from the lack of proper validation of a user-supplied path prior to using it in file operations. An attacker can leverage this vulnerability to execute code in the context of the www-data user. Was ZDI-CAN-24019.",TRUE
2020,CVE-2020-29056,9.8,"An issue was discovered on CDATA 72408A, 9008A, 9016A, 92408A, 92416A, 9288, 97016, 97024P, 97028P, 97042P, 97084P, 97168P, FD1002S, FD1104, FD1104B, FD1104S, FD1104SN, FD1108S, FD1204S-R2, FD1204SN, FD1204SN-R2, FD1208S-R2, FD1216S-R1, FD1608GS, FD1608SN, FD1616GS, FD1616SN, and FD8000 devices. One can escape from a shell and acquire root privileges by leveraging the TFTP download configuration.",CVE-2024-29056,Windows Authentication Elevation of Privilege Vulnerability,TRUE
2020,CVE-2020-16257,9.8,Winston 1.5.4 devices are vulnerable to command injection via the API.,CVE-2019-16257,"Some Motorola devices include the SIMalliance Toolbox Browser (aka S@T Browser) on the UICC, which might allow remote attackers to retrieve location and IMEI information, or retrieve other data or execute certain commands, via SIM Toolkit (STK) instructions in an SMS message, aka Simjacker.",TRUE
2020,CVE-2020-11819,9.8,"In Rukovoditel 2.5.2, an attacker may inject an arbitrary .php file location instead of a language file and thus achieve command execution.",CVE-2024-11819,A vulnerability classified as critical was found in 1000 Projects Portfolio Management System MCA 1.0. This vulnerability affects unknown code of the file /forgot_password_process.php. The manipulation of the argument username leads to sql injection. The attack can be initiated remotely. The exploit has been disclosed to the public and may be used.,TRUE
2020,CVE-2020-10233,9.1,"In version 4.8.0 and earlier of The Sleuth Kit (TSK), there is a heap-based buffer over-read in ntfs_dinode_lookup in fs/ntfs.c.",CVE-2024-10233,"The SMS Alert Order Notifications – WooCommerce plugin for WordPress is vulnerable to Stored Cross-Site Scripting via the plugin's sa_subscribe shortcode in all versions up to, and including, 3.7.5 due to insufficient input sanitization and output escaping on user supplied attributes. This makes it possible for authenticated attackers, with contributor-level access and above, to inject arbitrary web scripts in pages that will execute whenever a user accesses an injected page.",TRUE
2020,CVE-2020-0073,9.8,"In rw_t2t_handle_tlv_detect_rsp of rw_t2t_ndef.cc, there is a possible out of bounds write due to a missing bounds check. This could lead to remote code execution over NFC with no additional execution privileges needed. User interaction is not needed for exploitation.Product: AndroidVersions: Android-8.0 Android-8.1 Android-9 Android-10Android ID: A-147309942",CVE-2024-0073,"NVIDIA GPU Display Driver for Windows contains a vulnerability in the kernel mode layer when the driver is performing an operation at a privilege level that is higher than the minimum level required. A successful exploit of this vulnerability may lead to code execution, denial of service, escalation of privileges, information disclosure, and data tampering.",TRUE
2020,CVE-2020-15321,9.8,Zyxel CloudCNM SecuManager 3.1.0 and 3.1.1 has the axzyxel password for the livedbuser account.,CVE-2020-15321,Zyxel CloudCNM SecuManager 3.1.0 and 3.1.1 has the axzyxel password for the livedbuser account.,TRUE
2020,CVE-2020-22203,9.8,SQL Injection in phpCMS 2008 sp4 via the genre parameter to yp/job.php.,CVE-2024-22203,"Whoogle Search is a self-hosted metasearch engine. In versions prior to 0.8.4, the `element` method in `app/routes.py` does not validate the user-controlled `src_type` and `element_url` variables and passes them to the `send` method which sends a GET request on lines 339-343 in `request.py`, which leads to a server-side request forgery. This issue allows for crafting GET requests to internal and external resources on behalf of the server. For example, this issue would allow for accessing resources on the internal network that the server has access to, even though these resources may not be accessible on the internet. This issue is fixed in version 0.8.4.",TRUE
2020,CVE-2020-15180,9,"A flaw was found in the mysql-wsrep component of mariadb. Lack of input sanitization in `wsrep_sst_method` allows for command injection that can be exploited by a remote attacker to execute arbitrary commands on galera cluster nodes. This threatens the system's confidentiality, integrity, and availability. This flaw affects mariadb versions before 10.1.47, before 10.2.34, before 10.3.25, before 10.4.15 and before 10.5.6.",CVE-2018-15180,qTest Portal in QASymphony qTest Manager 9.0.0 has an Open Redirect via the /portal/loginform redirect parameter.,TRUE
2020,CVE-2020-2320,9.8,Jenkins Plugin Installation Manager Tool 2.1.3 and earlier does not verify plugin downloads.,CVE-2023-2320,"The CF7 Google Sheets Connector WordPress plugin before 5.0.2, cf7-google-sheets-connector-pro WordPress plugin through 5.0.2 does not escape a parameter before outputting it back in an attribute, leading to a Reflected Cross-Site Scripting which could be used against high privilege users such as admin",TRUE
2020,CVE-2020-15179,9,"The ScratchSig extension for MediaWiki before version 1.0.1 allows stored Cross-Site Scripting. Using <script> tag inside <scratchsig> tag, attackers with edit permission can execute scripts on visitors' browser. With MediaWiki JavaScript API, this can potentially lead to privilege escalation and/or account takeover. This has been patched in release 1.0.1. This has already been deployed to all Scratch Wikis. No workarounds exist other than disabling the extension completely.",CVE-2017-15179,Rejected reason: DO NOT USE THIS CANDIDATE NUMBER. ConsultIDs: none. Reason: This candidate was withdrawn by its CNA. Notes: none,TRUE
2020,CVE-2020-35665,9.8,An unauthenticated command-execution vulnerability exists in TerraMaster TOS through 4.2.06 via shell metacharacters in the Event parameter in include/makecvs.php during CSV creation.,CVE-2024-35665,Missing Authorization vulnerability in namithjawahar Insert Post Ads.This issue affects Insert Post Ads: from n/a through 1.3.2.,TRUE
2020,CVE-2020-27159,9.8,Addressed remote code execution vulnerability in DsdkProxy.php due to insufficient sanitization and insufficient validation of user input in Western Digital My Cloud NAS devices prior to 5.04.114,CVE-2024-27159,"All the Toshiba printers contain a shell script using the same hardcoded key to encrypt logs. An attacker can decrypt the encrypted files using the hardcoded key. This vulnerability can be executed in combination with other vulnerabilities and  difficult to execute alone. So, the CVSS score for this vulnerability alone is lower than the score listed in the ""Base Score"" of this vulnerability. For detail on related other vulnerabilities, please ask to the below contact point.
 https://www.toshibatec.com/contacts/products/  As for the affected products/models/versions, see the reference URL.",TRUE
2020,CVE-2020-25251,9.1,"An issue was discovered in Hyland OnBase 16.0.2.83 and below, 17.0.2.109 and below, 18.0.0.37 and below, 19.8.16.1000 and below and 20.3.10.1000 and below. Client-side authentication is used for critical functions such as adding users or retrieving sensitive information.",CVE-2024-25251,code-projects Agro-School Management System 1.0 is suffers from Incorrect Access Control.,TRUE
2020,CVE-2020-25111,9.8,An issue was discovered in the IPv6 stack in Contiki through 3.0. There is an insufficient check for the IPv6 header length. This leads to Denial-of-Service and potential Remote Code Execution via a crafted ICMPv6 echo packet.,CVE-2024-25111,"Squid is a web proxy cache. Starting in version 3.5.27 and prior to version 6.8, Squid may be vulnerable to a Denial of Service attack against HTTP Chunked decoder due to an uncontrolled recursion bug. This problem allows a remote attacker to cause Denial of Service when sending a crafted, chunked, encoded HTTP Message. This bug is fixed in Squid version 6.8. In addition, patches addressing this problem for the stable releases can be found in Squid's patch archives. There is no workaround for this issue.",TRUE
2020,CVE-2020-12747,9.8,"An issue was discovered on Samsung mobile devices with Q(10.0) (Exynos980 9630 and Exynos990 9830 chipsets) software. The Bootloader has a heap-based buffer overflow because of the mishandling of specific commands. The Samsung IDs are SVE-2020-16981, SVE-2020-16991 (May 2020).",CVE-2024-12747,"A flaw was found in rsync. This vulnerability arises from a race condition during rsync's handling of symbolic links. Rsync's default behavior when encountering symbolic links is to skip them. If an attacker replaced a regular file with a symbolic link at the right time, it was possible to bypass the default behavior and traverse symbolic links. Depending on the privileges of the rsync process, an attacker could leak sensitive information, potentially leading to privilege escalation.",TRUE
2020,CVE-2020-11167,9.8,"Memory corruption while calculating L2CAP packet length in reassembly logic when remote sends more data than expected in Snapdragon Auto, Snapdragon Compute, Snapdragon Connectivity, Snapdragon Consumer IOT, Snapdragon Industrial IOT, Snapdragon Mobile, Snapdragon Voice & Music, Snapdragon Wearables",CVE-2024-11167,An improper access control vulnerability in danny-avila/librechat versions prior to 0.7.6 allows authenticated users to delete other users' prompts via the groupid parameter. This issue occurs because the endpoint does not verify whether the provided prompt ID belongs to the current user.,TRUE
2020,CVE-2020-9024,9.8,Iteris Vantage Velocity Field Unit 2.3.1 and 2.4.2 devices have world-writable permissions for the /root/cleardata.pl (executed as root by crond) and /root/loadperl.sh (executed as root at boot time) scripts.,CVE-2024-9024,"The Material Design Icons plugin for WordPress is vulnerable to Stored Cross-Site Scripting via the plugin's mdi-icon shortcode in all versions up to, and including, 0.0.5 due to insufficient input sanitization and output escaping on user supplied attributes. This makes it possible for authenticated attackers, with contributor-level access and above, to inject arbitrary web scripts in pages that will execute whenever a user accesses an injected page.",TRUE
2020,CVE-2020-24719,9.8,"Exposed Erlang Cookie could lead to Remote Command Execution (RCE) attack. Communication between Erlang nodes is done by exchanging a shared secret (aka ""magic cookie""). There are cases where the magic cookie is included in the content of the logs. An attacker can use the cookie to attach to an Erlang node and run OS level commands on the system running the Erlang node. Affects version: 6.5.1. Fix version: 6.6.0.",CVE-2024-24719,Missing Authorization vulnerability in Uriahs Victor Location Picker at Checkout for WooCommerce.This issue affects Location Picker at Checkout for WooCommerce: from n/a through 1.8.9.,TRUE
2020,CVE-2020-20287,9.8,"Unrestricted file upload vulnerability in the yccms 3.3 project. The xhUp function's improper judgment of the request parameters, triggers remote code execution.",CVE-2024-20287,"A vulnerability in the web-based management interface of the Cisco WAP371 Wireless-AC/N Dual Radio Access Point (AP) with Single Point Setup could allow an authenticated, remote attacker to perform command injection attacks against an affected device. This vulnerability is due to improper validation of user-supplied input. An attacker could exploit this vulnerability by sending crafted HTTP requests to the web-based management interface of an affected system. A successful exploit could allow the attacker to execute arbitrary commands with root privileges on the device. To exploit this vulnerability, the attacker must have valid administrative credentials for the device.",TRUE
2020,CVE-2020-35184,9.8,The official composer docker images before 1.8.3 contain a blank password for a root user. System using the composer docker container deployed by affected versions of the docker image may allow a remote attacker to achieve root access with a blank password.,CVE-2024-35184,"Paperless-ngx is a document management system that transforms physical documents into a searchable online archive. Starting in version 2.5.0 and prior to version 2.8.6, remote user authentication allows API access even if API access is explicitly disabled. Version 2.8.6 contains a patchc for the issue.",TRUE
2020,CVE-2020-11136,9.8,"Buffer Over-read in audio driver while using malloc management function due to not returning NULL for zero sized memory requirement in Snapdragon Auto, Snapdragon Compute, Snapdragon Connectivity, Snapdragon Consumer IOT, Snapdragon Industrial IOT, Snapdragon IoT, Snapdragon Mobile, Snapdragon Voice & Music, Snapdragon Wearables, Snapdragon Wired Infrastructure and Networking",CVE-2024-11136,The default TCL Camera application exposes a provider vulnerable to path traversal vulnerability. Malicious application can supply malicious URI path and delete arbitrary files from user’s external storage.,TRUE
2020,CVE-2020-4429,9.8,"IBM Data Risk Manager 2.0.1, 2.0.2, 2.0.3, 2.0.4, 2.0.5, and 2.0.6 contains a default password for an IDRM administrative account. A remote attacker could exploit this vulnerability to login and execute arbitrary code on the system with root privileges. IBM X-Force ID: 180534.",CVE-2024-4429,"Cross-Site Request Forgery vulnerability has been discovered in OpenText™ iManager 3.2.6.0200. This
could lead to sensitive information disclosure.",TRUE
2020,CVE-2020-4208,9.8,"IBM Spectrum Protect Plus 10.1.0 through 10.1.5 contains hard-coded credentials, such as a password or cryptographic key, which it uses for its own inbound authentication, outbound communication to external components, or encryption of internal data. IBM X-Force ID: 174975.",CVE-2024-4208,"The Gutenberg Blocks with AI by Kadence WP – Page Builder Features plugin for WordPress is vulnerable to Stored Cross-Site Scripting via the typer effect in the advanced heading widget in all versions up to, and including, 3.2.37 due to insufficient input sanitization and output escaping on user supplied attributes. This makes it possible for authenticated attackers, with contributor-level access and above, to inject arbitrary web scripts in pages that will execute whenever a user accesses an injected page.",TRUE
2020,CVE-2020-25952,9.8,SQL injection vulnerability in PHPGurukul User Registration & Login and User Management System With admin panel 2.1 allows remote attackers to execute arbitrary SQL commands and bypass authentication.,CVE-2024-25952,"Dell PowerScale OneFS versions 8.2.2.x through 9.7.0.x contains an UNIX symbolic link (symlink) following vulnerability. A local high privileged attacker could potentially exploit this vulnerability, leading to denial of service, information tampering.",TRUE
2021,CVE-2021-38194,9.8,"An issue was discovered in the ark-r1cs-std crate before 0.3.1 for Rust. It does not enforce any constraints in the FieldVar::mul_by_inverse method. Thus, a prover can produce a proof that is unsound but is nonetheless verified.",CVE-2024-38194,An authenticated attacker can exploit an improper authorization vulnerability in Azure Web Apps to elevate privileges over a network.,TRUE
2021,CVE-2021-37163,9.8,An insecure permissions issue was discovered in HMI3 Control Panel in Swisslog Healthcare Nexus operated by released versions of software before Nexus Software 7.2.5.7. The device has two user accounts with passwords that are hardcoded.,CVE-2024-37163,"SkyScrape is a GUI Dashboard for AWS Infrastructure and Managing Resources and Usage Costs.  SkyScrape's API requests are currently unsecured HTTP requests, leading to potential vulnerabilities for the user's temporary credentials and data.  This affects version 1.0.0.",TRUE
2021,CVE-2021-38917,9.1,"IBM PowerVM Hypervisor FW860, FW940, and FW950 could allow an attacker that gains service access to the FSP can read and write arbitrary host system memory through a series of carefully crafted service procedures. IBM X-Force ID: 210018.",CVE-2021-24424,"The WP Reset – Most Advanced WordPress Reset Tool WordPress plugin before 1.90 did not sanitise or escape its extra_data parameter when creating a snapshot via the admin dashboard, leading to an authenticated Stored Cross-Site Scripting issue",FALSE
2021,CVE-2021-21972,9.8,"The vSphere Client (HTML5) contains a remote code execution vulnerability in a vCenter Server plugin. A malicious actor with network access to port 443 may exploit this issue to execute commands with unrestricted privileges on the underlying operating system that hosts vCenter Server. This affects VMware vCenter Server (7.x before 7.0 U1c, 6.7 before 6.7 U3l and 6.5 before 6.5 U3n) and VMware Cloud Foundation (4.x before 4.2 and 3.x before 3.10.1.2).",CVE-2024-21972,An out of bounds write vulnerability in the AMD Radeon™ user mode driver for DirectX® 11 could allow an attacker with access to a malformed shader to potentially achieve arbitrary code execution.,TRUE
2021,CVE-2021-38923,9.1,IBM PowerVM Hypervisor FW1010 could allow a privileged user to gain access to another VM due to assigning duplicate WWPNs. IBM X-Force ID: 210162.,CVE-2024-38923,Open Robotics Robotic Operating System 2 (ROS2) and Nav2 humble versions were discovered to contain a use-after-free via the nav2_amcl process. This vulnerability is triggered via remotely sending a request to change the value of dynamic-parameter`/amcl odom_frame_id` .,TRUE
2021,CVE-2021-21321,10,"fastify-reply-from is an npm package which is a fastify plugin to forward the current http request to another server. In fastify-reply-from before version 4.0.2, by crafting a specific URL, it is possible to escape the prefix of the proxied backend service. If the base url of the proxied server is ""/pub/"", a user expect that accessing ""/priv"" on the target service would not be possible. In affected versions, it is possible. This is fixed in version 4.0.2.",CVE-2023-21321,"In Package Manager, there is a possible cross-user settings disclosure due to a missing permission check. This could lead to local information disclosure with no additional execution privileges needed. User interaction is not needed for exploitation.",TRUE
2021,CVE-2021-27157,9.8,An issue was discovered on FiberHome HG6245D devices through RP2613. The web daemon contains the hardcoded admin / 888888 credentials for an ISP.,CVE-2024-27157,"The sessions are stored in clear-text logs. An attacker can retrieve authentication sessions. A remote attacker can retrieve the credentials and bypass the authentication mechanism. As for the affected products/models/versions, see the reference URL.",TRUE
2021,CVE-2021-22848,9.8,HGiga MailSherlock contains a SQL Injection. Remote attackers can inject SQL syntax and execute SQL commands in a URL parameter of email pages without privilege.,CVE-2023-22848,Improper access control in some Intel(R) Thunderbolt(TM) DCH drivers for Windows before version 88 may allow an authenticated user to potentially enable denial of service via local access.,TRUE
2021,CVE-2021-20617,9.8,"Improper access control vulnerability in acmailer ver. 4.0.1 and earlier, and acmailer DB ver. 1.1.3 and earlier allows remote attackers to execute an arbitrary OS command, or gain an administrative privilege which may result in obtaining the sensitive information on the server via unspecified vectors.",CVE-2022-20617,"Jenkins Docker Commons Plugin 1.17 and earlier does not sanitize the name of an image or a tag, resulting in an OS command execution vulnerability exploitable by attackers with Item/Configure permission or able to control the contents of a previously configured job's SCM repository.",TRUE
2021,CVE-2021-40113,10,"Multiple vulnerabilities in the web-based management interface of the Cisco Catalyst Passive Optical Network (PON) Series Switches Optical Network Terminal (ONT) could allow an unauthenticated, remote attacker to perform the following actions: Log in with a default credential if the Telnet protocol is enabled Perform command injection Modify the configuration For more information about these vulnerabilities, see the Details section of this advisory.",CVE-2024-40113,Sitecom WLX-2006 Wall Mount Range Extender N300 v.1.5 and before is vulnerable to Use of Default Credentials.,TRUE
2021,CVE-2021-27664,9.8,Under certain configurations an unauthenticated remote user could be given access to credentials stored in the exacqVision Server.,CVE-2022-27664,"In net/http in Go before 1.18.6 and 1.19.x before 1.19.1, attackers can cause a denial of service because an HTTP/2 connection can hang during closing if shutdown were preempted by a fatal error.",TRUE
2021,CVE-2021-24931,9.8,"The Secure Copy Content Protection and Content Locking WordPress plugin before 2.8.2 does not escape the sccp_id parameter of the ays_sccp_results_export_file AJAX action (available to both unauthenticated and authenticated users) before using it in a SQL statement, leading to an SQL injection.",CVE-2024-24931,Improper Neutralization of Input During Web Page Generation ('Cross-site Scripting') vulnerability in swadeshswain Before After Image Slider WP allows Stored XSS.This issue affects Before After Image Slider WP: from n/a through 2.2.,TRUE
2021,CVE-2021-42115,9.1,Missing HTTPOnly flag in Web Applications operating on Business-DNA Solutions GmbH’s TopEase® Platform Version <= 7.1.27 allows an unauthenticated remote attacker to escalate privileges from unauthenticated to authenticated user via stealing and injecting the session- independent and static cookie UID.,CVE-2022-42115,Cross-site scripting (XSS) vulnerability in the Object module's edit object details page in Liferay Portal 7.4.3.4 through 7.4.3.36 allows remote attackers to inject arbitrary web script or HTML via a crafted payload injected into the object field's `Label` text field.,TRUE
2021,CVE-2021-37401,9.8,"An attacker may obtain the user credentials from file servers, backup repositories, or ZLD files saved in SD cards. As a result, the PLC user program may be uploaded, altered, and/or downloaded.",CVE-2024-37401,An out-of-bounds read in IPsec of Ivanti Connect Secure before version 22.7R2.1 allows a remote unauthenticated attacker to cause a denial of service.,TRUE
2021,CVE-2021-21892,9.9,A stack-based buffer overflow vulnerability exists in the Web Manager FsUnmount functionality of Lantronix PremierWave 2050 8.9.0.0R4 (in QEMU). A specially crafted HTTP request can lead to remote code execution. An attacker can make an authenticated HTTP request to trigger this vulnerability.,CVE-2024-21892,"On Linux, Node.js ignores certain environment variables if those may have been set by an unprivileged user while the process is running with elevated privileges with the only exception of CAP_NET_BIND_SERVICE. Due to a bug in the implementation of this exception, Node.js incorrectly applies this exception even when certain other capabilities have been set. This allows unprivileged users to inject code that inherits the process's elevated privileges.",TRUE
