Year,CVE_ID,CVSS_Score,RAG,Matching_CVE_ID,Matching_Description,Match_Found
2018,CVE-2018-11940,9.8,"Lack of check in length before using memcpy in WLAN function can lead to OOB access in Snapdragon Auto, Snapdragon Compute, Snapdragon Consumer IOT, Snapdragon Industrial IOT, Snapdragon Mobile in MDM9150, MDM9206, MDM9607, MDM9640, MDM9650, MSM8996AU, QCS605, SD 625, SD 636, SD 712 / SD 710 / SD 670, SD 820, SD 820A, SD 835, SD 845 / SD 850, SD 855, SDA660, SDM630, SDM660, SDX20, SDX24, SXR1130",CVE-2024-11940,"The Property Hive Mortgage Calculator plugin for WordPress is vulnerable to Stored Cross-Site Scripting via the ‘price’ parameter in all versions up to, and including, 1.0.6 due to insufficient input sanitization and output escaping. This makes it possible for authenticated attackers, with Contributor-level access and above, to inject arbitrary web scripts in pages that will execute whenever a user accesses an injected page.",TRUE
2018,CVE-2018-14599,9.8,"An issue was discovered in libX11 through 1.6.5. The function XListExtensions in ListExt.c is vulnerable to an off-by-one error caused by malicious server responses, leading to DoS or possibly unspecified other impact.",CVE-2020-14599,"Vulnerability in the Oracle CRM Gateway for Mobile Devices product of Oracle E-Business Suite (component: Setup of Mobile Applications). Supported versions that are affected are 12.1.1-12.1.3. Easily exploitable vulnerability allows unauthenticated attacker with network access via HTTP to compromise Oracle CRM Gateway for Mobile Devices. Successful attacks of this vulnerability can result in unauthorized creation, deletion or modification access to critical data or all Oracle CRM Gateway for Mobile Devices accessible data as well as unauthorized access to critical data or complete access to all Oracle CRM Gateway for Mobile Devices accessible data. CVSS 3.1 Base Score 9.1 (Confidentiality and Integrity impacts). CVSS Vector: (CVSS:3.1/AV:N/AC:L/PR:N/UI:N/S:U/C:H/I:H/A:N).",TRUE
2018,CVE-2018-15632,9.1,"Improper input validation in database creation logic in Odoo Community 11.0 and earlier and Odoo Enterprise 11.0 and earlier, allows remote attackers to initialize an empty database on which they can connect with default credentials.",CVE-2020-15632,This vulnerability allows network-adjacent attackers to bypass authentication on affected installations of D-Link DIR-842 3.13B05 routers. Authentication is not required to exploit this vulnerability. The specific flaw exists within the processing of HNAP GetCAPTCHAsetting requests. The issue results from the lack of proper handling of sessions. An attacker can leverage this vulnerability to execute arbitrary code in the context of the device. Was ZDI-CAN-10083.,TRUE
2018,CVE-2018-1567,9.8,"IBM WebSphere Application Server 7.0, 8.0, 8.5, and 9.0 could allow remote attackers to execute arbitrary Java code through the SOAP connector with a serialized object from untrusted sources. IBM X-Force ID: 143024.",CVE-2024-1567,"The Royal Elementor Addons and Templates plugin for WordPress is vulnerable to limited file uploads due to missing file type validation in the 'file_validity' function in all versions up to, and including, 1.3.94. This makes it possible for unauthenticated attackers to upload dangerous file types such as .svgz on the affected site's server which may make cross-site scripting or remote code execution possible.",TRUE
2018,CVE-2018-4852,9.8,A vulnerability has been identified in SICLOCK TC100 (All versions) and SICLOCK TC400 (All versions). An attacker with network access to the device could potentially circumvent the authentication mechanism if he/she is able to obtain certain knowledge specific to the attacked device.,CVE-2023-4852,A vulnerability was found in IBOS OA 4.5.5 and classified as critical. This issue affects some unknown processing of the file ?r=dashboard/database/optimize. The manipulation leads to sql injection. The attack may be initiated remotely. The exploit has been disclosed to the public and may be used. The identifier VDB-239261 was assigned to this vulnerability.,TRUE
2018,CVE-2018-17570,9.8,utils/ut_ws_svr.c in ViaBTC Exchange Server before 2018-08-21 has an integer overflow leading to memory corruption.,CVE-2019-17570,An untrusted deserialization was found in the org.apache.xmlrpc.parser.XmlRpcResponseParser:addResult method of Apache XML-RPC (aka ws-xmlrpc) library. A malicious XML-RPC server could target a XML-RPC client causing it to execute arbitrary code. Apache XML-RPC is no longer maintained and this issue will not be fixed.,TRUE
2018,CVE-2018-13314,9.8,"System command injection in formAliasIp in TOTOLINK A3002RU version 1.0.8 allows attackers to execute system commands via the ""ipAddr"" POST parameter.",CVE-2024-13314,"The Carousel, Slider, Gallery by WP Carousel  WordPress plugin before 2.7.4 does not sanitise and escape some of its settings, which could allow high privilege users such as admin to perform Stored Cross-Site Scripting attacks even when the unfiltered_html capability is disallowed (for example in multisite setup).",TRUE
2018,CVE-2018-5781,9.8,"A vulnerability in the conferencing component of Mitel Connect ONSITE, versions R1711-PREM and earlier, and Mitel ST 14.2, release GA28 and earlier, could allow an unauthenticated attacker to inject PHP code using specially crafted requests to the vendrecording.php page. Successful exploit could allow an attacker to execute arbitrary PHP code within the context of the application.",CVE-2024-5781,Rejected reason: This CVE ID has been rejected or withdrawn by its CVE Numbering Authority.,TRUE
2018,CVE-2018-5551,9,"Versions of DocuTrac QuicDoc and Office Therapy that ship with DTISQLInstaller.exe version 1.6.4.0 and prior contain three credentials with known passwords: QDMaster, OTMaster, and sa.",CVE-2024-5551,"The WP STAGING Pro WordPress Backup Plugin plugin for WordPress is vulnerable to Cross-Site Request Forgery in all versions up to, and including, 5.6.0. This is due to missing or incorrect nonce validation on the 'sub' parameter called from the WP STAGING WordPress Backup Plugin - Backup Duplicator & Migration plugin. This makes it possible for unauthenticated attackers to include any local files that end in '-settings.php' via a forged request granted they can trick a site administrator into performing an action such as clicking on a link.",TRUE
2018,CVE-2018-20395,9.8,NETWAVE MNG6200 C4835805jrc12FU121413.cpr devices allow remote attackers to discover credentials via iso.3.6.1.4.1.4491.2.4.1.1.6.1.1.0 and iso.3.6.1.4.1.4491.2.4.1.1.6.1.2.0 SNMP requests.,CVE-2024-20395,"A vulnerability in the media retrieval functionality of Cisco Webex App could allow an unauthenticated, adjacent attacker to gain access to sensitive session information.This vulnerability is due to insecure transmission of requests to backend services when the app accesses embedded media, such as images. An attacker could exploit this vulnerability by sending a message with embedded media that is stored on a messaging server to a targeted user. If the attacker can observe transmitted traffic in a privileged network position, a successful exploit could allow the attacker to capture session token information from insecurely transmitted requests and possibly reuse the captured session information to take further actions as the targeted user.",TRUE
2018,CVE-2018-3866,9.9,"An exploitable buffer overflow vulnerability exists in the samsungWifiScan handler of video-core's HTTP server of Samsung SmartThings Hub STH-ETH-250 - Firmware version 0.20.17. The video-core process incorrectly extracts fields from a user-controlled JSON payload, leading to a buffer overflow on the stack. The strcpy at [8] overflows the destination buffer, which has a size of 40 bytes. An attacker can send an arbitrarily long 'callbackUrl' value in order to exploit this vulnerability.",CVE-2024-3866,"The Ninja Forms Contact Form plugin for WordPress is vulnerable to Reflected Self-Based Cross-Site Scripting via the 'Referer' header in all versions up to, and including, 3.8.15 due to insufficient input sanitization and output escaping. This makes it possible for unauthenticated attackers to inject arbitrary web scripts in pages that execute if they can successfully trick a user into performing an action such as clicking on a link. Successful exploitation of this vulnerability requires ""maintenance mode"" for a targeted form to be enabled. However, there is no setting available to the attacker or even an administrator-level user to enable this mode. The mode is only enabled during a required update, which is a very short window of time. Additionally, because of the self-based nature of this vulnerability, attackers would have to rely on additional techniques to execute a supplied payload in the context of targeted user.",TRUE
2018,CVE-2018-6210,9.8,"D-Link DIR-620 devices, with a certain Rostelekom variant of firmware 1.0.37, have a hardcoded rostel account, which makes it easier for remote attackers to obtain access via a TELNET session.",CVE-2024-6210,"The Duplicator plugin for WordPress is vulnerable to information exposure in all versions up to, and including, 1.5.9. This makes it possible for unauthenticated attackers to obtain the full path to instances, which they may be able to use in combination with other vulnerabilities or to simplify reconnaissance work. On its own, this information is of very limited use.",TRUE
2018,CVE-2018-2870,9.1,"Vulnerability in the Oracle Human Resources component of Oracle E-Business Suite (subcomponent: General Utilities). Supported versions that are affected are 12.1.1, 12.1.2, 12.1.3, 12.2.3, 12.2.4, 12.2.5, 12.2.6 and 12.2.7. Easily exploitable vulnerability allows unauthenticated attacker with network access via HTTP to compromise Oracle Human Resources. Successful attacks of this vulnerability can result in unauthorized creation, deletion or modification access to critical data or all Oracle Human Resources accessible data as well as unauthorized access to critical data or complete access to all Oracle Human Resources accessible data. CVSS 3.0 Base Score 9.1 (Confidentiality and Integrity impacts). CVSS Vector: (CVSS:3.0/AV:N/AC:L/PR:N/UI:N/S:U/C:H/I:H/A:N).",CVE-2024-2870,"The socialdriver-framework WordPress plugin before 2024.04.30 does not sanitise and escape a parameter before outputting it back in the page, leading to a Reflected Cross-Site Scripting which could be used against high privilege users such as admin",TRUE
2018,CVE-2018-10466,9.8,Zoho ManageEngine ADAudit Plus before 5.0.0 build 5100 allows blind SQL Injection.,CVE-2024-10466,"By sending a specially crafted push message, a remote server could have hung the parent process, causing the browser to become unresponsive. This vulnerability affects Firefox < 132, Firefox ESR < 128.4, Thunderbird < 128.4, and Thunderbird < 132.",TRUE
2018,CVE-2018-6292,9.8,Remote Code Execution in Saperion Web Client version 7.5.2 83166.,CVE-2024-6292,Use after free in Dawn in Google Chrome prior to 126.0.6478.126 allowed a remote attacker to potentially exploit heap corruption via a crafted HTML page. (Chromium security severity: High),TRUE
2018,CVE-2018-1295,9.8,"In Apache Ignite 2.3 or earlier, the serialization mechanism does not have a list of classes allowed for serialization/deserialization, which makes it possible to run arbitrary code when 3-rd party vulnerable classes are present in Ignite classpath. The vulnerability can be exploited if the one sends a specially prepared form of a serialized object to one of the deserialization endpoints of some Ignite components - discovery SPI, Ignite persistence, Memcached endpoint, socket steamer.",CVE-2024-1295,"The events-calendar-pro WordPress plugin before 6.4.0.1, The Events Calendar WordPress plugin before 6.4.0.1 does not prevent users with at least the contributor role from leaking details about events they shouldn't have access to. (e.g. password-protected events, drafts, etc.)",TRUE
2018,CVE-2018-15386,9.8,"A vulnerability in Cisco Digital Network Architecture (DNA) Center could allow an unauthenticated, remote attacker to bypass authentication and have direct unauthorized access to critical management functions. The vulnerability is due to an insecure default configuration of the affected system. An attacker could exploit this vulnerability by directly connecting to the exposed services. An exploit could allow the attacker to retrieve and modify critical system files.",CVE-2020-15386,"Brocade Fabric OS prior to v9.0.1a and 8.2.3a and after v9.0.0 and 8.2.2d may observe high CPU load during security scanning, which could lead to a slower response to CLI commands and other operations.",TRUE
2018,CVE-2018-12575,9.8,"On TP-Link TL-WR841N v13 00000001 0.9.1 4.16 v0001.0 Build 171019 Rel.55346n devices, all actions in the web interface are affected by bypass of authentication via an HTTP request.",CVE-2020-12575,Rejected reason: DO NOT USE THIS CANDIDATE NUMBER. ConsultIDs: none. Reason: This candidate is unused by its CNA. Notes: none.,TRUE
2018,CVE-2018-20784,9.8,"In the Linux kernel before 4.20.2, kernel/sched/fair.c mishandles leaf cfs_rq's, which allows attackers to cause a denial of service (infinite loop in update_blocked_averages) or possibly have unspecified other impact by inducing a high load.",CVE-2024-20784,Adobe Experience Manager versions 6.5.20 and earlier are affected by a stored Cross-Site Scripting (XSS) vulnerability that could be abused by an attacker to inject malicious scripts into vulnerable form fields. Malicious JavaScript may be executed in a victim’s browser when they browse to the page containing the vulnerable field.,TRUE
2018,CVE-2018-13904,9.8,"Improper input validation in SCM handler to access storage in TZ can lead to unauthorized access in Snapdragon Auto, Snapdragon Compute, Snapdragon Consumer Electronics Connectivity, Snapdragon Consumer IOT, Snapdragon Industrial IOT, Snapdragon Mobile in versions MDM9206, MDM9607, MDM9650, MDM9655, QCS605, SD 410/12, SD 675, SD 712 / SD 710 / SD 670, SD 8CX, SXR1130.",CVE-2024-13904,"The Platform.ly for WooCommerce plugin for WordPress is vulnerable to Blind Server-Side Request Forgery in all versions up to, and including, 1.1.6 via the 'hooks' function. This makes it possible for unauthenticated attackers to make web requests to arbitrary locations originating from the web application and can be used to query and modify information from internal services.",TRUE
2018,CVE-2018-16618,9.8,"VTech Storio Max before 56.D3JM6 allows remote command execution via shell metacharacters in an Android activity name. It exposes the storeintenttranslate.x service on port 1668 listening for requests on localhost. Requests submitted to this service are checked for a string of random characters followed by the name of an Android activity to start. Activities are started by inserting their name into a string that is executed in a shell command. By inserting metacharacters this can be exploited to run arbitrary commands as root. The requests also match those of the HTTP protocol and can be triggered on any web page rendered on the device by requesting resources stored at an http://127.0.0.1:1668/ URI, as demonstrated by the http://127.0.0.1:1668/dacdb70556479813fab2d92896596eef?';{ping,example.org}' URL.",CVE-2017-16618,"An exploitable vulnerability exists in the YAML loading functionality of util.py in OwlMixin before 2.0.0a12. A ""Load YAML"" string or file (aka load_yaml or load_yamlf) can execute arbitrary Python commands resulting in command execution because load is used where safe_load should have been used. An attacker can insert Python into loaded YAML to trigger this vulnerability.",TRUE
2018,CVE-2018-16791,9.8,"In SolarWinds SFTP/SCP Server through 2018-09-10, the configuration file is world readable and writable, and stores user passwords in an insecure manner, allowing an attacker to determine passwords for potentially privileged accounts. This also grants the attacker an ability to backdoor the server.",CVE-2020-16791,Rejected reason: DO NOT USE THIS CANDIDATE NUMBER. ConsultIDs: none. Reason: This candidate was in a CNA pool that was not assigned to any issues during 2020. Notes: none,TRUE
2018,CVE-2018-16879,9.8,Ansible Tower before version 3.3.3 does not set a secure channel as it is using the default insecure configuration channel settings for messaging celery workers from RabbitMQ. This could lead in data leak of sensitive information such as passwords as well as denial of service attacks by deleting projects or inventory files.,CVE-2020-16879,"<p>An information disclosure vulnerability exists when a Windows Projected Filesystem improperly handles file redirections. An attacker who successfully exploited this vulnerability could obtain information to further compromise the user's system</p> <p>To exploit this vulnerability, an attacker would first have to log on to the system. An attacker could then run a specially crafted application that could exploit the vulnerability.</p> <p>The security update addresses the vulnerability by correcting how Windows Projected Filesystem handle file redirections.</p>",TRUE
2018,CVE-2018-8823,9.8,modules/bamegamenu/ajax_phpcode.php in the Responsive Mega Menu (Horizontal+Vertical+Dropdown) Pro module 1.0.32 for PrestaShop 1.5.5.0 through 1.7.2.5 allows remote attackers to execute arbitrary PHP code via the code parameter.,CVE-2024-8823,"PDF-XChange Editor JB2 File Parsing Out-Of-Bounds Read Information Disclosure Vulnerability. This vulnerability allows remote attackers to disclose sensitive information on affected installations of PDF-XChange Editor. User interaction is required to exploit this vulnerability in that the target must visit a malicious page or open a malicious file. The specific flaw exists within the parsing of JB2 files. The issue results from the lack of proper validation of user-supplied data, which can result in a read past the end of an allocated object. An attacker can leverage this in conjunction with other vulnerabilities to execute arbitrary code in the context of the current process. Was ZDI-CAN-24261.",TRUE
2018,CVE-2018-8794,9.8,rdesktop versions up to and including v1.8.3 contain an Integer Overflow that leads to an Out-Of-Bounds Write in function process_bitmap_updates() and results in a memory corruption and possibly even a remote code execution.,CVE-2024-8794,"The BA Book Everything plugin for WordPress is vulnerable to arbitrary password reset in all versions up to, and including, 1.6.20. This is due to the reset_user_password() function not verifying a user's identity prior to setting a password. This makes it possible for unauthenticated attackers to reset any user's passwords, including administrators. It's important to note that the attacker will not have access to the generated password, therefore, privilege escalation is not possible.",TRUE
2018,CVE-2018-14916,9.1,LOYTEC LGATE-902 6.3.2 devices allow Arbitrary file deletion.,CVE-2019-14916,"An issue was discovered in PRiSE adAS 1.7.0. A file's format is not properly checked, leading to an unrestricted file upload.",TRUE
2018,CVE-2018-7890,9.8,"A remote code execution issue was discovered in Zoho ManageEngine Applications Manager before 13.6 (build 13640). The publicly accessible testCredential.do endpoint takes multiple user inputs and validates supplied credentials by accessing a specified system. This endpoint calls several internal classes, and then executes a PowerShell script. If the specified system is OfficeSharePointServer, then the username and password parameters to this script are not validated, leading to Command Injection.",CVE-2024-7890,Local privilege escalation allows a low-privileged user to gain SYSTEM privileges in Citrix Workspace app for Windows,TRUE
2018,CVE-2018-8014,9.8,"The defaults settings for the CORS filter provided in Apache Tomcat 9.0.0.M1 to 9.0.8, 8.5.0 to 8.5.31, 8.0.0.RC1 to 8.0.52, 7.0.41 to 7.0.88 are insecure and enable 'supportsCredentials' for all origins. It is expected that users of the CORS filter will have configured it appropriately for their environment rather than using it in the default configuration. Therefore, it is expected that most users will not be impacted by this issue.",CVE-2024-8014,"In Progress Telerik Reporting versions prior to 2024 Q3 (18.2.24.924), a code execution attack is possible through object injection via an insecure type resolution vulnerability.",TRUE
2018,CVE-2018-17172,9.8,"The web application on Xerox AltaLink B80xx before 100.008.028.05200, C8030/C8035 before 100.001.028.05200, C8045/C8055 before 100.002.028.05200, and C8070 before 100.003.028.05200 allows unauthenticated command injection.",CVE-2017-17172,"Huawei smart phones LYO-L21 with software LYO-L21C479B107, LYO-L21C479B107 have a privilege escalation vulnerability. An authenticated, local attacker can crafts malformed packets after tricking a user to install a malicious application and exploit this vulnerability when in the exception handling process. Successful exploitation may cause the attacker to obtain a higher privilege of the smart phones.",TRUE
2018,CVE-2018-6345,9.8,"The function number_format is vulnerable to a heap overflow issue when its second argument ($dec_points) is excessively large. The internal implementation of the function will cause a string to be created with an invalid length, which can then interact poorly with other functions. This affects all supported versions of HHVM (3.30.1 and 3.27.5 and below).",CVE-2024-6345,"A vulnerability in the package_index module of pypa/setuptools versions up to 69.1.1 allows for remote code execution via its download functions. These functions, which are used to download packages from URLs provided by users or retrieved from package index servers, are susceptible to code injection. If these functions are exposed to user-controlled inputs, such as package URLs, they can execute arbitrary commands on the system. The issue is fixed in version 70.0.",TRUE
2018,CVE-2018-9852,9.8,"In Gxlcms QY v1.0.0713, Lib\Lib\Action\Home\HitsAction.class.php allows remote attackers to read data from a database by embedding a FROM clause in a query string within a Home-Hits request, as demonstrated hy sid=user,password%20from%20mysql.user%23.",CVE-2024-9852,"Uncontrolled Search Path Element vulnerability in ICONICS GENESIS64 all versions, Mitsubishi Electric GENESIS64 all versions and Mitsubishi Electric MC Works64 all versions allows a local authenticated attacker to execute a malicious code by storing a specially crafted DLL in a specific folder. This could lead to disclose, tamper with, destroy, or delete information in the affected products, or cause a denial of service (DoS) condition on the products.",TRUE
2018,CVE-2018-12336,9.8,Undocumented Factory Backdoor in ECOS Secure Boot Stick (aka SBS) 5.6.5 allows the vendor to extract confidential information via remote root SSH access.,CVE-2024-12336,"The WC Affiliate – A Complete WooCommerce Affiliate Plugin plugin for WordPress is vulnerable to unauthorized access of data due to a missing capability check on the 'export_all_data' function in all versions up to, and including, 2.5.3. This makes it possible for authenticated attackers, with Subscriber-level access and above, to expose sensitive affiliate data, including personally identifiable information (PII).",TRUE
2018,CVE-2018-6911,9.8,The VBWinExec function in Node\AspVBObj.dll in Advantech WebAccess 8.3.0 allows remote attackers to execute arbitrary OS commands via a single argument (aka the command parameter).,CVE-2024-6911,Files on the Windows system are accessible without authentication to external parties due to a local file inclusion in PerkinElmer ProcessPlus.This issue affects ProcessPlus: through 1.11.6507.0.,TRUE
2018,CVE-2018-14749,9.8,"Buffer Overflow vulnerability in QTS 4.3.5 build 20181013, QTS 4.3.4 build 20181008, QTS 4.3.3 build 20180829, QTS 4.2.6 build 20180829 and earlier versions could have unspecified impact on the NAS.",CVE-2019-14749,"An issue was discovered in osTicket before 1.10.7 and 1.12.x before 1.12.1. CSV (aka Formula) injection exists in the export spreadsheets functionality. These spreadsheets are generated dynamically from unvalidated or unfiltered user input in the Name and Internal Notes fields in the Users tab, and the Issue Summary field in the tickets tab. This allows other agents to download data in a .csv file format or .xls file format. This is used as input for spreadsheet applications such as Excel and OpenOffice Calc, resulting in a situation where cells in the spreadsheets can contain input from an untrusted source. As a result, the end user who is accessing the exported spreadsheet can be affected.",TRUE
2018,CVE-2018-19514,9.8,"In Webgalamb through 7.0, an arbitrary code execution vulnerability could be exploited remotely without authentication. Exploitation requires authentication bypass to access administrative functions of the site to upload a crafted CSV file with a malicious payload that becomes part of a PHP eval() expression in the subscriber.php file.",CVE-2019-19514,Ayision Ays-WR01 v28K.RPT.20161224 devices allow stored XSS in basic repeater settings via an SSID.,TRUE
