Year,CVE_ID,CVSS_Score,RAG,Matching_CVE_ID,Matching_Description,Match_Found
2023,CVE-2023-35813,9.8,"Multiple Sitecore products allow remote code execution. This affects Experience Manager, Experience Platform, and Experience Commerce through 10.3.",CVE-2024-35813,"In the Linux kernel, the following vulnerability has been resolved:
mmc: core: Avoid negative index with array access
Commit 4d0c8d0aef63 (""mmc: core: Use mrq.sbc in close-ended ffu"") assigns
prev_idata = idatas[i - 1], but doesn't check that the iterator i is
greater than zero. Let's fix this by adding a check.",TRUE
2023,CVE-2023-0788,9.8,Code Injection in GitHub repository thorsten/phpmyfaq prior to 3.1.11.,CVE-2024-0788,SUPERAntiSpyware Pro X v10.0.1260 is vulnerable to kernel-level API parameters manipulation and Denial of Service vulnerabilities by triggering the 0x9C402140 IOCTL code of the saskutil64.sys driver.,TRUE
2023,CVE-2023-2989,9.1,"Fortra Globalscape EFT versions before 8.1.0.16 suffer from an out of bounds memory read in their administration server, which can allow an attacker to crash the service or bypass authentication if successfully exploited",CVE-2024-2989,"A vulnerability, which was classified as critical, has been found in Tenda FH1203 2.0.1.6. Affected by this issue is the function fromNatStaticSetting of the file /goform/NatStaticSetting. The manipulation of the argument page leads to stack-based buffer overflow. The attack may be launched remotely. The exploit has been disclosed to the public and may be used. VDB-258158 is the identifier assigned to this vulnerability. NOTE: The vendor was contacted early about this disclosure but did not respond in any way.",TRUE
2023,CVE-2023-45343,9.8,Online Food Ordering System v1.0 is vulnerable to multiple Unauthenticated SQL Injection vulnerabilities. The 'ticket_id' parameter of the routers/ticket-message.php resource does not validate the characters received and they are sent unfiltered to the database.,CVE-2024-45343,Rejected reason: reserved but not needed,TRUE
2023,CVE-2023-51478,9.8,Improper Authentication vulnerability in Abdul Hakeem Build App Online allows Privilege Escalation.This issue affects Build App Online: from n/a through 1.0.19.,CVE-2024-51478,"YesWiki is a wiki system written in PHP. Prior to 4.4.5, the use of a weak cryptographic algorithm and a hard-coded salt to hash the password reset key allows it to be recovered and used to reset the password of any account. This issue is fixed in 4.4.5.",TRUE
2023,CVE-2023-40005,9.8,Missing Authorization vulnerability in Easy Digital Downloads Easy Digital Downloads allows Exploiting Incorrectly Configured Access Control Security Levels.This issue affects Easy Digital Downloads: from n/a through 3.1.5.,CVE-2022-40005,"Intelbras WiFiber 120AC inMesh before 1-1-220826 allows command injection by authenticated users, as demonstrated by the /boaform/formPing6 and /boaform/formTracert URIs for ping and traceroute.",TRUE
2023,CVE-2023-44019,9.8,Tenda AC10U v1.0 US_AC10UV1.0RTL_V15.03.06.49_multi_TDE01 was discovered to contain a stack overflow via the mac parameter in the GetParentControlInfo function.,CVE-2024-44019,Missing Authorization vulnerability in Renzo Johnson Contact Form 7 Campaign Monitor Extension allows Accessing Functionality Not Properly Constrained by ACLs.This issue affects Contact Form 7 Campaign Monitor Extension: from n/a through 0.4.67.,TRUE
2023,CVE-2023-43902,9.8,"Incorrect access control in the Forgot Your Password function of EMSigner v2.8.7 allows unauthenticated attackers to access accounts of all registered users, including those with administrator privileges via a crafted password reset token.",CVE-2024-43902,"In the Linux kernel, the following vulnerability has been resolved:
drm/amd/display: Add null checker before passing variables
Checks null pointer before passing variables to functions.
This fixes 3 NULL_RETURNS issues reported by Coverity.",TRUE
2023,CVE-2023-2519,9.8,A vulnerability has been found in Caton CTP Relay Server 1.2.9 and classified as critical. This vulnerability affects unknown code of the file /server/api/v1/login of the component API. The manipulation of the argument username/password leads to sql injection. The attack can be initiated remotely. VDB-228010 is the identifier assigned to this vulnerability. NOTE: The vendor was contacted early about this disclosure but did not respond in any way.,CVE-2024-2519,A vulnerability was found in MAGESH-K21 Online-College-Event-Hall-Reservation-System 1.0. It has been classified as problematic. Affected is an unknown function of the file navbar.php. The manipulation of the argument id leads to cross site scripting. It is possible to launch the attack remotely. The exploit has been disclosed to the public and may be used. The identifier of this vulnerability is VDB-256956. NOTE: The vendor was contacted early about this disclosure but did not respond in any way.,TRUE
2023,CVE-2023-30378,9.8,"In Tenda AC15 V15.03.05.19, the function ""sub_8EE8"" contains a stack-based buffer overflow vulnerability.",CVE-2022-30378,Sourcecodester Simple Social Networking Site v1.0 is vulnerable to SQL Injection via /sns/admin/?page=posts/view_post&id=.,TRUE
2023,CVE-2023-28812,9.1,"There is a buffer overflow vulnerability in a web browser plug-in could allow an attacker to exploit the vulnerability by sending crafted messages to computers installed with this plug-in, which could lead to arbitrary code execution or cause process exception of the plug-in.",CVE-2024-28812,An issue was discovered in Infinera hiT 7300 5.60.50. A hidden SSH service (on the local management network interface) with hardcoded credentials allows attackers to access the appliance operating system (with highest privileges) via an SSH connection.,TRUE
2023,CVE-2023-29800,9.8,TOTOLINK X18 V9.1.0cu.2024_B20220329 was discovered to contain a command injection vulnerability via the FileName parameter in the UploadFirmwareFile function.,CVE-2024-29800,Deserialization of Untrusted Data vulnerability in Timber Team & Contributors Timber.This issue affects Timber: from n/a through 1.23.0.,TRUE
2023,CVE-2023-3658,9.8,"A vulnerability, which was classified as critical, was found in SourceCodester AC Repair and Services System 1.0. Affected is an unknown function of the file Master.php?f=delete_book of the component HTTP POST Request Handler. The manipulation of the argument id leads to sql injection. It is possible to launch the attack remotely. The identifier of this vulnerability is VDB-234012.",CVE-2024-3658,Rejected reason: ** REJECT ** DO NOT USE THIS CANDIDATE NUMBER. ConsultIDs: CVE-2023-51478. Reason: This candidate is a reservation duplicate of CVE-2023-51478. Notes: All CVE users should reference CVE-2023-51478 instead of this candidate. All references and descriptions in this candidate have been removed to prevent accidental usage.,TRUE
2024,CVE-2024-20719,9.1,"Adobe Commerce versions 2.4.6-p3, 2.4.5-p5, 2.4.4-p6 and earlier are affected by a stored Cross-Site Scripting (XSS) vulnerability that could be abused by an admin attacker to inject malicious scripts into every admin page. Malicious JavaScript may be executed in a victims browser when they browse to the page containing the vulnerable field, that could be leveraged to gain admin access.",CVE-2023-20719,"In pqframework, there is a possible out of bounds read due to a missing bounds check. This could lead to local information disclosure with System execution privileges needed. User interaction is not needed for exploitation. Patch ID: ALPS07629583; Issue ID: ALPS07629583.",TRUE
2024,CVE-2024-1001,9.8,A vulnerability classified as critical has been found in Totolink N200RE 9.3.5u.6139_B20201216. Affected is the function main of the file /cgi-bin/cstecgi.cgi. The manipulation leads to stack-based buffer overflow. It is possible to launch the attack remotely. The exploit has been disclosed to the public and may be used. VDB-252270 is the identifier assigned to this vulnerability. NOTE: The vendor was contacted early about this disclosure but did not respond in any way.,CVE-2023-1001,"A vulnerability, which was classified as problematic, has been found in xuliangzhan vxe-table up to 3.7.9. This issue affects the function export of the file packages/textarea/src/textarea.js of the component vxe-textarea. The manipulation of the argument inputValue leads to cross site scripting. The attack may be initiated remotely. Upgrading to version 3.7.10 is able to address this issue. The patch is named d70b0e089740b65a22c89c106ebc4627ac48a22d. It is recommended to upgrade the affected component. The associated identifier of this vulnerability is VDB-266123.",TRUE
2024,CVE-2024-29725,9.8,"SQL injection vulnerabilities in SportsNET affecting version 4.0.1. These vulnerabilities could allow an attacker to retrieve, update and delete all information in the database by sending a specially crafted SQL query: https://XXXXXXX.saludydesafio.com/app/ax/sort_bloques/, parameter list.",CVE-2023-29725,"The BT21 x BTS Wallpaper app 12 for Android allows unauthorized applications to actively request permission to insert data into the database that records information about a user's personal preferences and will be loaded into memory to be read and used when the application is opened. By injecting data, the attacker can force the application to load malicious image URLs and display them in the UI. As the amount of data increases, it will eventually cause the application to trigger an OOM error and crash, resulting in a persistent denial of service attack.",TRUE
2024,CVE-2024-53677,9.8,"File upload logic in Apache Struts is flawed. An attacker can manipulate file upload params to enable paths traversal and under some circumstances this can lead to uploading a malicious file which can be used to perform Remote Code Execution.

This issue affects Apache Struts: from 2.0.0 before 6.4.0.

Users are recommended to upgrade to version 6.4.0 at least and migrate to the new  file upload mechanism https://struts.apache.org/core-developers/file-upload . If you are not using an old file upload logic based on FileuploadInterceptor your application is safe.

You can find more details in  https://cwiki.apache.org/confluence/display/WW/S2-067",CVE-2024-34799,Missing Authorization vulnerability in Repute Infosystems BookingPress.This issue affects BookingPress: from n/a through 1.0.82.,FALSE
2024,CVE-2024-0469,9.8,A vulnerability was found in code-projects Human Resource Integrated System 1.0 and classified as critical. Affected by this issue is some unknown functionality of the file update_personal_info.php. The manipulation of the argument sex leads to sql injection. The attack may be launched remotely. The exploit has been disclosed to the public and may be used. VDB-250574 is the identifier assigned to this vulnerability.,CVE-2023-0469,A use-after-free flaw was found in io_uring/filetable.c in io_install_fixed_file in the io_uring subcomponent in the Linux Kernel during call cleanup. This flaw may lead to a denial of service.,TRUE
2024,CVE-2024-30628,9.8,Tenda FH1205 v2.0.0.7(775) has a stack overflow vulnerability in the page parameter from fromAddressNat function.,CVE-2023-30628,"Kiwi TCMS is an open source test management system. In kiwitcms/Kiwi v12.2 and prior and kiwitcms/enterprise v12.2 and prior,
the `changelog.yml` workflow is vulnerable to command injection attacks because of using an untrusted `github.head_ref` field. The `github.head_ref` value is an attacker-controlled value. Assigning the value to `zzz"";echo${IFS}""hello"";#` can lead to command injection. Since the permission is not restricted, the attacker has a write-access to the repository. Commit 834c86dfd1b2492ccad7ebbfd6304bfec895fed2 of the kiwitcms/Kiwi repository and commit e39f7e156fdaf6fec09a15ea6f4e8fec8cdbf751 of the kiwitcms/enterprise repository contain a fix for this issue.",TRUE
2024,CVE-2024-24023,9.8,"A SQL injection vulnerability exists in Novel-Plus v4.3.0-RC1 and prior. An attacker can pass specially crafted offset, limit, and sort parameters to perform SQL injection via /novel/bookContent/list.",CVE-2023-24023,"Bluetooth BR/EDR devices with Secure Simple Pairing and Secure Connections pairing in Bluetooth Core Specification 4.2 through 5.4 allow certain man-in-the-middle attacks that force a short key length, and might lead to discovery of the encryption key and live injection, aka BLUFFS.",TRUE
2024,CVE-2024-0300,9.8,A vulnerability was found in Byzoro Smart S150 Management Platform up to 20240101. It has been rated as critical. Affected by this issue is some unknown functionality of the file /useratte/userattestation.php of the component HTTP POST Request Handler. The manipulation of the argument web_img leads to unrestricted upload. The attack may be launched remotely. The exploit has been disclosed to the public and may be used. VDB-249866 is the identifier assigned to this vulnerability. NOTE: The vendor was contacted early about this disclosure but did not respond in any way.,CVE-2023-0300,Cross-site Scripting (XSS) - Reflected in GitHub repository alfio-event/alf.io prior to 2.0-M4-2301.,TRUE
2024,CVE-2024-12791,9.8,A vulnerability was found in Codezips E-Commerce Site 1.0. It has been rated as critical. This issue affects some unknown processing of the file signin.php. The manipulation of the argument email leads to sql injection. The attack may be initiated remotely. The exploit has been disclosed to the public and may be used.,CVE-2019-12791,A directory traversal vulnerability in the v-list-user script in Vesta Control Panel 0.9.8-24 allows remote attackers to escalate from regular registered users to root via the password reset form.,TRUE
2024,CVE-2024-11048,8.8,A vulnerability was found in D-Link DI-8003 16.07.16A1. It has been rated as critical. Affected by this issue is the function dbsrv_asp of the file /dbsrv.asp. The manipulation of the argument str leads to stack-based buffer overflow. The attack may be launched remotely. The exploit has been disclosed to the public and may be used.,CVE-2020-11048,"In FreeRDP after 1.0 and before 2.0.0, there is an out-of-bounds read. It only allows to abort a session. No data extraction is possible. This has been fixed in 2.0.0.",TRUE
2024,CVE-2024-3908,9.8,A vulnerability classified as critical has been found in Tenda AC500 2.0.1.9(1307). Affected is the function formWriteFacMac of the file /goform/WriteFacMac. The manipulation of the argument mac leads to command injection. It is possible to launch the attack remotely. The exploit has been disclosed to the public and may be used. The identifier of this vulnerability is VDB-261144. NOTE: The vendor was contacted early about this disclosure but did not respond in any way.,CVE-2023-3908,Rejected reason: This CVE ID has been rejected or withdrawn by its CVE Numbering Authority.,TRUE
2024,CVE-2024-1061,9.8,"The 'HTML5 Video Player' WordPress Plugin, version < 2.5.25 is affected by an unauthenticated SQL injection vulnerability in the 'id' parameter in the  'get_view' function.",CVE-2023-1061,"A vulnerability, which was classified as critical, has been found in SourceCodester Doctors Appointment System 1.0. This issue affects some unknown processing of the file /admin/edit-doc.php. The manipulation of the argument email/oldmail leads to sql injection. The attack may be initiated remotely. The exploit has been disclosed to the public and may be used.",TRUE
2024,CVE-2024-22319,9.8,"IBM Operational Decision Manager 8.10.3, 8.10.4, 8.10.5.1, 8.11, 8.11.0.1, 8.11.1 and 8.12.0.1 is susceptible to remote code execution attack via JNDI injection when passing an unchecked argument to a certain API. IBM X-Force ID: 279145.",CVE-2023-22319,A sql injection vulnerability exists in the requestHandlers.js LoginAuth functionality of Milesight VPN v2.0.2. A specially-crafted network request can lead to authentication bypass. An attacker can send a malicious packet to trigger this vulnerability.,TRUE
2024,CVE-2024-22216,10,"In default installations of Microchip maxView Storage Manager (for Adaptec Smart Storage Controllers) where Redfish server is configured for remote system management, unauthorized access can occur, with data modification and information disclosure. This affects 3.00.23484 through 4.14.00.26064 (except for the patched versions 3.07.23980 and 4.07.00.25339).",CVE-2021-22216,"A denial of service vulnerability in all versions of GitLab CE/EE before 13.12.2, 13.11.5 or 13.10.5 allows an attacker to cause uncontrolled resource consumption with a very long issue or merge request description",TRUE
2024,CVE-2024-9011,9.8,"A vulnerability, which was classified as critical, was found in code-projects Crud Operation System 1.0. Affected is an unknown function of the file updata.php. The manipulation of the argument sid leads to sql injection. It is possible to launch the attack remotely. The exploit has been disclosed to the public and may be used.",CVE-2019-9011,"In Pilz PMC programming tool 3.x before 3.5.17 (based on CODESYS Development System), an attacker can identify valid usernames.",TRUE
2024,CVE-2024-29874,9.8,"SQL injection vulnerability in Sentrifugo 3.2, through /sentrifugo/index.php/default/reports/activeuserrptpdf, 'sort_name' parameter. The exploitation of this vulnerability could allow  a remote user to send a specially crafted query to the server and extract all the data from it.",CVE-2022-29874,"A vulnerability has been identified in SICAM P850 (All versions < V3.00), SICAM P855 (All versions < V3.00). Affected devices do not encrypt web traffic with clients but communicate in cleartext via HTTP. This could allow an unauthenticated attacker to capture the traffic and interfere with the functionality of the device.",TRUE
2024,CVE-2024-1197,9.8,"A vulnerability, which was classified as critical, has been found in SourceCodester Testimonial Page Manager 1.0. This issue affects some unknown processing of the file delete-testimonial.php of the component HTTP GET Request Handler. The manipulation of the argument testimony leads to sql injection. The attack may be initiated remotely. The associated identifier of this vulnerability is VDB-252695.",CVE-2023-1197,Cross-site Scripting (XSS) - Stored in GitHub repository uvdesk/community-skeleton prior to 1.1.0.,TRUE
2024,CVE-2024-11317,10,"Session Fixation vulnerabilities allow an attacker to fix a users session identifier before login providing an opportunity for session takeover on a product. 
Affected products:
ABB ASPECT - Enterprise v3.08.02; 
NEXUS Series v3.08.02; 
MATRIX Series v3.08.02",CVE-2020-11317,Rejected reason: DO NOT USE THIS CANDIDATE NUMBER. ConsultIDs: none. Reason: This candidate was in a CNA pool that was not assigned to any issues during 2020. Notes: none,TRUE
2024,CVE-2024-6213,9.8,A vulnerability was found in SourceCodester Food Ordering Management System up to 1.0. It has been classified as critical. This affects an unknown part of the file login.php of the component Login Panel. The manipulation of the argument username leads to sql injection. It is possible to initiate the attack remotely. The exploit has been disclosed to the public and may be used. The identifier VDB-269277 was assigned to this vulnerability.,CVE-2023-6213,Memory safety bugs present in Firefox 119. Some of these bugs showed evidence of memory corruption and we presume that with enough effort some of these could have been exploited to run arbitrary code. This vulnerability affects Firefox < 120.,TRUE
2024,CVE-2024-43591,9.1,Azure Command Line Integration (CLI) Elevation of Privilege Vulnerability,CVE-2023-43591,Improper privilege management  in Zoom Rooms for macOS before version 5.16.0 may allow an authenticated user to conduct an escalation of privilege via local access.,TRUE
2024,CVE-2024-26289,9.8,"Deserialization of Untrusted Data vulnerability in PMB Services PMB allows Remote Code Inclusion.This issue affects PMB: from 7.5.1 before 7.5.6-2, from 7.4.1 before 7.4.9, from 7.3.1 before 7.3.18.",CVE-2023-26289,"IBM Aspera Orchestrator 4.0.1 is vulnerable to HTTP header injection, caused by improper validation of input by the HOST headers.  This could allow an attacker to conduct various attacks against the vulnerable system, including cross-site scripting, cache poisoning or session hijacking.  IBM X-Force ID:  248478.",TRUE
2024,CVE-2024-2927,9.8,A vulnerability was found in code-projects Mobile Shop 1.0. It has been classified as critical. Affected is an unknown function of the file Details.php of the component Login Page. The manipulation of the argument id leads to sql injection. It is possible to launch the attack remotely. The exploit has been disclosed to the public and may be used. The identifier of this vulnerability is VDB-258000.,CVE-2023-2927,A vulnerability was found in JIZHICMS 2.4.5. It has been classified as critical. Affected is the function index of the file TemplateController.php. The manipulation of the argument webapi leads to server-side request forgery. It is possible to launch the attack remotely. The exploit has been disclosed to the public and may be used. VDB-230082 is the identifier assigned to this vulnerability.,TRUE
2024,CVE-2024-38124,9,Windows Netlogon Elevation of Privilege Vulnerability,CVE-2023-38124,"Inductive Automation Ignition OPC UA Quick Client Task Scheduling Exposed Dangerous Function Remote Code Execution Vulnerability. This vulnerability allows remote attackers to execute arbitrary code on affected installations of Inductive Automation Ignition. Authentication is required to exploit this vulnerability.
The specific flaw exists within the Ignition Gateway server. The issue results from the exposure of a dangerous function. An attacker can leverage this vulnerability to execute code in the context of SYSTEM. Was ZDI-CAN-20541.",TRUE
2024,CVE-2024-39228,9.8,"GL-iNet products AR750/AR750S/AR300M/AR300M16/MT300N-V2/B1300/MT1300/SFT1200/X750 v4.3.11, MT3000/MT2500/AXT1800/AX1800/A1300/X300B v4.5.16, XE300 v4.3.16, E750 v4.3.12, AP1300/S1300 v4.3.13, and XE3000/X3000 v4.4 were discovered to contain a shell injection vulnerability via the interface check_ovpn_client_config and check_config.",CVE-2023-39228,Improper access control for some Intel Unison software may allow an unauthenticated user to potentially enable denial of service via network access.,TRUE
2024,CVE-2024-0712,9.8,A vulnerability was found in Byzoro Smart S150 Management Platform V31R02B15. It has been classified as critical. Affected is an unknown function of the file /useratte/inc/userattea.php. The manipulation leads to improper access controls. It is possible to launch the attack remotely. The exploit has been disclosed to the public and may be used. VDB-251538 is the identifier assigned to this vulnerability. NOTE: The vendor was contacted early about this disclosure but did not respond in any way.,CVE-2023-0712,"The Wicked Folders plugin for WordPress is vulnerable to authorization bypass due to a missing capability check on the ajax_move_object function in versions up to, and including, 2.18.16. This makes it possible for authenticated attackers, with subscriber-level permissions and above, to invoke this function and perform actions intended for administrators such as modifying the folder structure maintained by the plugin.",TRUE
2024,CVE-2024-3930,9.8,In versions of Akana API Platform prior to 2024.1.0 a flaw resulting in XML External Entity (XXE) was discovered.,CVE-2023-3930,Rejected reason: This CVE ID has been rejected or withdrawn by its CVE Numbering Authority.,TRUE
2024,CVE-2024-7190,9.8,A vulnerability classified as critical was found in itsourcecode Society Management System 1.0. Affected by this vulnerability is an unknown functionality of the file /admin/get_price.php. The manipulation of the argument expenses_id leads to sql injection. The attack can be launched remotely. The exploit has been disclosed to the public and may be used. The associated identifier of this vulnerability is VDB-272611.,CVE-2023-7190,"A vulnerability, which was classified as critical, has been found in S-CMS up to 2.0_build20220529-20231006. Affected by this issue is some unknown functionality of the file /member/ad.php?action=ad. The manipulation of the argument A_text/A_url/A_contact leads to sql injection. The exploit has been disclosed to the public and may be used. The identifier of this vulnerability is VDB-249392. NOTE: The vendor was contacted early about this disclosure but did not respond in any way.",TRUE
2024,CVE-2024-0471,9.8,A vulnerability was found in code-projects Human Resource Integrated System 1.0. It has been declared as critical. This vulnerability affects unknown code of the file /admin_route/dec_service_credits.php. The manipulation of the argument date leads to sql injection. The attack can be initiated remotely. The exploit has been disclosed to the public and may be used. The identifier of this vulnerability is VDB-250576.,CVE-2023-0471,Use after free in WebTransport in Google Chrome prior to 109.0.5414.119 allowed a remote attacker to potentially exploit heap corruption via a crafted HTML page. (Chromium security severity: High),TRUE
2024,CVE-2024-7362,9.8,"A vulnerability, which was classified as critical, has been found in SourceCodester Tracking Monitoring Management System 1.0. This issue affects some unknown processing of the file /manage_user.php. The manipulation of the argument id leads to sql injection. The attack may be initiated remotely. The exploit has been disclosed to the public and may be used. The identifier VDB-273341 was assigned to this vulnerability.",CVE-2019-7362,"DLL preloading vulnerability in Autodesk Design Review versions 2011, 2012, 2013, and 2018. An attacker may trick a user into opening a malicious DWF file that may leverage a DLL preloading vulnerability, which may result in code execution.",TRUE
