Year,CVE_ID,CVSS_Score,RAG,Matching_CVE_ID,Matching_Description,Match_Found
2016,CVE-2016-0212,9.8,"Stack-based buffer overflow in IBM Tivoli Storage Manager FastBack 5.5 and 6.1.x through 6.1.11.1 allows remote attackers to cause a denial of service (daemon crash) via unspecified vectors, a different vulnerability than CVE-2016-0213 and CVE-2016-0216.",CVE-2024-0212,"The Cloudflare Wordpress plugin was found to be vulnerable to improper authentication. The vulnerability enables attackers with a lower privileged account to access data from the Cloudflare API.
",TRUE
2016,CVE-2016-4694,9.1,"The Apache HTTP Server in Apple OS X before 10.12 and OS X Server before 5.2 follows RFC 3875 section 4.1.18 and therefore does not protect applications from the presence of untrusted CGI client data in the HTTP_PROXY environment variable, which might allow remote attackers to redirect an application's outbound HTTP traffic to an arbitrary proxy server via a crafted Proxy header in an HTTP request, aka an ""httpoxy"" issue, a related issue to CVE-2016-5387.",CVE-2023-4694,Certain HP OfficeJet Pro printers are potentially vulnerable to a Denial of Service when sending a SOAP message to the service on TCP port 3911 that contains a body but no header.,TRUE
2016,CVE-2016-3444,9.8,"Unspecified vulnerability in the Oracle Retail Integration Bus component in Oracle Retail Applications 13.0, 13.1, 13.2, 14.0, 14.1, and 15.0 allows remote attackers to affect confidentiality, integrity, and availability via vectors related to Install.",CVE-2024-3444,A vulnerability was found in Wangshen SecGate 3600 up to 20240408. It has been classified as critical. This affects an unknown part of the file /?g=net_pro_keyword_import_save. The manipulation of the argument reqfile leads to unrestricted upload. It is possible to initiate the attack remotely. The exploit has been disclosed to the public and may be used. The identifier VDB-259701 was assigned to this vulnerability.,TRUE
2016,CVE-2016-5050,9.8,Unrestricted file upload vulnerability in chat/sendfile.aspx in ReadyDesk 9.1 allows remote attackers to execute arbitrary code by uploading and requesting a .aspx file.,CVE-2024-5050,"A vulnerability, which was classified as critical, was found in Wangshen SecGate 3600 up to 20240516. This affects an unknown part of the file /?g=log_import_save. The manipulation of the argument reqfile leads to unrestricted upload. It is possible to initiate the attack remotely. The associated identifier of this vulnerability is VDB-264747.",TRUE
2016,CVE-2016-8438,9.8,Integer overflow leading to a TOCTOU condition in hypervisor PIL. An integer overflow exposes a race condition that may be used to bypass (Peripheral Image Loader) PIL authentication. Product: Android. Versions: Kernel 3.18. Android ID: A-31624565. References: QC-CR#1023638.,CVE-2024-8438,"A path traversal vulnerability exists in modelscope/agentscope version v.0.0.4. The API endpoint `/api/file` does not properly sanitize the `path` parameter, allowing an attacker to read arbitrary files on the server.",TRUE
2016,CVE-2016-6290,9.8,"ext/session/session.c in PHP before 5.5.38, 5.6.x before 5.6.24, and 7.x before 7.0.9 does not properly maintain a certain hash data structure, which allows remote attackers to cause a denial of service (use-after-free) or possibly have unspecified other impact via vectors related to session deserialization.",CVE-2024-6290,Use after free in Dawn in Google Chrome prior to 126.0.6478.126 allowed a remote attacker to potentially exploit heap corruption via a crafted HTML page. (Chromium security severity: High),TRUE
2016,CVE-2016-1560,9.8,"ExaGrid appliances with firmware before 4.8 P26 have a default password of (1) inflection for the root shell account and (2) support for the support account in the web interface, which allows remote attackers to obtain administrative access via an SSH or HTTP session.",CVE-2024-1560,"A path traversal vulnerability exists in the mlflow/mlflow repository, specifically within the artifact deletion functionality. Attackers can bypass path validation by exploiting the double decoding process in the `_delete_artifact_mlflow_artifacts` handler and `local_file_uri_to_path` function, allowing for the deletion of arbitrary directories on the server's filesystem. This vulnerability is due to an extra unquote operation in the `delete_artifacts` function of `local_artifact_repo.py`, which fails to properly sanitize user-supplied paths. The issue is present up to version 2.9.2, despite attempts to fix a similar issue in CVE-2023-6831.",TRUE
2016,CVE-2016-5689,9.8,The DCM reader in ImageMagick before 6.9.4-5 and 7.x before 7.0.1-7 allows remote attackers to have unspecified impact by leveraging lack of NULL pointer checks.,CVE-2024-5689,"In addition to detecting when a user was taking a screenshot (XXX), a website was able to overlay the 'My Shots' button that appeared, and direct the user to a replica Firefox Screenshots page that could be used for phishing. This vulnerability affects Firefox < 127.",TRUE
2016,CVE-2016-9536,9.8,"tools/tiff2pdf.c in libtiff 4.0.6 has out-of-bounds write vulnerabilities in heap allocated buffers in t2p_process_jpeg_strip(). Reported as MSVR 35098, aka ""t2p_process_jpeg_strip heap-buffer-overflow.""",CVE-2024-9536,A vulnerability was found in ESAFENET CDG V5. It has been rated as critical. Affected by this issue is some unknown functionality of the file /MultiServerBackService?path=1. The manipulation of the argument fileId leads to sql injection. The attack may be launched remotely. The exploit has been disclosed to the public and may be used. The vendor was contacted early about this disclosure but did not respond in any way.,TRUE
2016,CVE-2016-5788,10,"General Electric (GE) Bently Nevada 3500/22M USB with firmware before 5.0 and Bently Nevada 3500/22M Serial have open ports, which makes it easier for remote attackers to obtain privileged access via unspecified vectors.",CVE-2024-5788,"The Silesia theme for WordPress is vulnerable to Stored Cross-Site Scripting via the ‘link’ attribute within the theme's Button shortcode in all versions up to, and including, 1.0.6 due to insufficient input sanitization and output escaping. This makes it possible for authenticated attackers, with Contributor-level access and above, to inject arbitrary web scripts in pages that will execute whenever a user accesses an injected page.",TRUE
2016,CVE-2016-4262,9.8,"Adobe Digital Editions before 4.5.2 allows attackers to execute arbitrary code or cause a denial of service (memory corruption) via unspecified vectors, a different vulnerability than CVE-2016-4256, CVE-2016-4257, CVE-2016-4258, CVE-2016-4259, CVE-2016-4260, and CVE-2016-4261.",CVE-2024-4262,"The Piotnet Addons For Elementor plugin for WordPress is vulnerable to Stored Cross-Site Scripting via multiple widgets in all versions up to, and including, 2.4.28 due to insufficient input sanitization and output escaping on user supplied attributes. This makes it possible for authenticated attackers, with contributor-level access and above, to inject arbitrary web scripts in pages that will execute whenever a user accesses an injected page.",TRUE
2016,CVE-2016-7145,9.8,The m_authenticate function in ircd/m_authenticate.c in nefarious2 allows remote attackers to spoof certificate fingerprints and consequently log in as another user via a crafted AUTHENTICATE parameter.,CVE-2024-7145,"The JetElements plugin for WordPress is vulnerable to Local File Inclusion in all versions up to, and including, 2.6.20 via the 'progress_type' parameter. This makes it possible for authenticated attackers, with Contributor-level access and above, to include and execute arbitrary files on the server, allowing the execution of any PHP code in those files. This can be used to bypass access controls, obtain sensitive data, or achieve code execution in cases where images and other “safe” file types can be uploaded and included.",TRUE
2016,CVE-2016-5281,9.8,"Use-after-free vulnerability in the DOMSVGLength class in Mozilla Firefox before 49.0, Firefox ESR 45.x before 45.4, and Thunderbird < 45.4 allows remote attackers to execute arbitrary code by leveraging improper interaction between JavaScript code and an SVG document.",CVE-2024-5281,"The wp-affiliate-platform WordPress plugin before 6.5.1 does not sanitise and escape a parameter before outputting it back in the page, leading to a Reflected Cross-Site Scripting which could be used against high privilege users such as admin",TRUE
2016,CVE-2016-1761,9.8,"libxml2 in Apple iOS before 9.3, OS X before 10.11.4, and watchOS before 2.2 allows remote attackers to execute arbitrary code or cause a denial of service (memory corruption) via a crafted XML document.",CVE-2024-1761,"The WP Chat App plugin for WordPress is vulnerable to Stored Cross-Site Scripting via the plugin's widget/block in all versions up to, and including, 3.6.1 due to insufficient input sanitization and output escaping on user supplied attributes such as 'buttonColor' and 'phoneNumber'. This makes it possible for authenticated attackers with contributor-level and above permissions to inject arbitrary web scripts in pages that will execute whenever a user accesses an injected page.",TRUE
2016,CVE-2016-7129,9.8,"The php_wddx_process_data function in ext/wddx/wddx.c in PHP before 5.6.25 and 7.x before 7.0.10 allows remote attackers to cause a denial of service (segmentation fault) or possibly have unspecified other impact via an invalid ISO 8601 time value, as demonstrated by a wddx_deserialize call that mishandles a dateTime element in a wddxPacket XML document.",CVE-2023-7129,"A vulnerability, which was classified as critical, was found in code-projects Voting System 1.0. Affected is an unknown function of the component Voters Login. The manipulation of the argument voter leads to sql injection. The exploit has been disclosed to the public and may be used. The identifier of this vulnerability is VDB-249132.",TRUE
2016,CVE-2016-2051,9.8,"Multiple unspecified vulnerabilities in Google V8 before 4.8.271.17, as used in Google Chrome before 48.0.2564.82, allow attackers to cause a denial of service or possibly have other impact via unknown vectors.",CVE-2024-2051,"CWE-307: Improper Restriction of Excessive Authentication Attempts vulnerability exists that
could cause account takeover and unauthorized access to the system when an attacker
conducts brute-force attacks against the login form.",TRUE
2016,CVE-2016-3655,9.8,"The management web interface in Palo Alto Networks PAN-OS before 5.0.18, 6.0.x before 6.0.13, 6.1.x before 6.1.10, and 7.0.x before 7.0.5 allows remote attackers to execute arbitrary OS commands via an unspecified API call.",CVE-2024-3655,"Use After Free vulnerability in Arm Ltd Bifrost GPU Kernel Driver, Arm Ltd Valhall GPU Kernel Driver, Arm Ltd Arm 5th Gen GPU Architecture Kernel Driver allows a local non-privileged user to make improper GPU memory processing operations to gain access to already freed memory.This issue affects Bifrost GPU Kernel Driver: from r43p0 through r49p0; Valhall GPU Kernel Driver: from r43p0 through r49p0; Arm 5th Gen GPU Architecture Kernel Driver: from r43p0 through r49p0.",TRUE
2016,CVE-2016-7943,9.8,"The XListFonts function in X.org libX11 before 1.6.4 might allow remote X servers to gain privileges via vectors involving length fields, which trigger out-of-bounds write operations.",CVE-2024-7943,A vulnerability was found in itsourcecode Laravel Property Management System 1.0 and classified as critical. This issue affects the function upload of the file PropertiesController.php. The manipulation of the argument file leads to unrestricted upload. The attack may be initiated remotely. The exploit has been disclosed to the public and may be used.,TRUE
2016,CVE-2016-7161,9.8,Heap-based buffer overflow in the .receive callback of xlnx.xps-ethernetlite in QEMU (aka Quick Emulator) allows attackers to execute arbitrary code on the QEMU host via a large ethlite packet.,CVE-2024-7161,A vulnerability classified as problematic was found in SeaCMS 13.0. Affected by this vulnerability is an unknown functionality of the file /member.php?action=chgpwdsubmit of the component Password Change Handler. The manipulation of the argument newpwd/newpwd2 leads to cross-site request forgery. The attack can be launched remotely. The exploit has been disclosed to the public and may be used. The associated identifier of this vulnerability is VDB-272575.,TRUE
2016,CVE-2016-2141,9.8,"It was found that JGroups did not require necessary headers for encrypt and auth protocols from new nodes joining the cluster. An attacker could use this flaw to bypass security restrictions, and use this vulnerability to send and receive messages within the cluster, leading to information disclosure, message spoofing, or further possible attacks.",CVE-2024-2141,"The Ultimate Addons for Beaver Builder – Lite plugin for WordPress is vulnerable to Stored Cross-Site Scripting via the Button widget in all versions up to, and including, 1.5.7 due to insufficient input sanitization and output escaping. This makes it possible for authenticated attackers, with contributor-level access and above, to inject arbitrary web scripts in pages that will execute whenever a user accesses an injected page.",TRUE
2016,CVE-2016-6147,9.8,"An unspecified interface in SAP TREX 7.10 Revision 63 allows remote attackers to execute arbitrary OS commands with SIDadm privileges via unspecified vectors, aka SAP Security Note 2234226.",CVE-2024-6147,"Poly Plantronics Hub Link Following Local Privilege Escalation Vulnerability. This vulnerability allows local attackers to escalate privileges on affected installations of Poly Plantronics Hub. An attacker must first obtain the ability to execute low-privileged code on the target system in order to exploit this vulnerability.
The specific flaw exists within the Spokes Update Service. By creating a symbolic link, an attacker can abuse the service to delete a file. An attacker can leverage this vulnerability to escalate privileges and execute arbitrary code in the context of SYSTEM. Was ZDI-CAN-18271.",TRUE
2016,CVE-2016-0841,9.8,"media/libmedia/mediametadataretriever.cpp in mediaserver in Android 4.x before 4.4.4, 5.0.x before 5.0.2, 5.1.x before 5.1.1, and 6.x before 2016-04-01 mishandles cleared service binders, which allows remote attackers to execute arbitrary code or cause a denial of service (memory corruption) via a crafted media file, aka internal bug 26040840.",CVE-2024-0841,A null pointer dereference flaw was found in the hugetlbfs_fill_super function in the Linux kernel hugetlbfs (HugeTLB pages) functionality. This issue may allow a local user to crash the system or potentially escalate their privileges on the system.,TRUE
2016,CVE-2016-0859,9.8,Integer overflow in the Kernel service in Advantech WebAccess before 8.1 allows remote attackers to execute arbitrary code or cause a denial of service (stack-based buffer overflow) via a crafted RPC request.,CVE-2024-0859,"The Affiliates Manager plugin for WordPress is vulnerable to Cross-Site Request Forgery in all versions up to, and including, 2.9.34. This is due to missing or incorrect nonce validation on the process_bulk_action function in ListAffiliatesTable.php. This makes it possible for unauthenticated attackers to delete affiliates via a forged request granted they can trick a site administrator into performing an action such as clicking on a link.",TRUE
2016,CVE-2016-2785,9.8,Puppet Server before 2.3.2 and Ruby puppetmaster in Puppet 4.x before 4.4.2 and in Puppet Agent before 1.4.2 might allow remote attackers to bypass intended auth.conf access restrictions by leveraging incorrect URL decoding.,CVE-2024-2785,"The The Plus Addons for Elementor plugin for WordPress is vulnerable to Stored Cross-Site Scripting via the Age Gate widget in all versions up to, and including, 5.4.2 due to insufficient input sanitization and output escaping on user supplied attributes. This makes it possible for authenticated attackers, with contributor-level access and above, to inject arbitrary web scripts in pages that will execute whenever a user accesses an injected page.",TRUE
2016,CVE-2016-7560,9.8,"The rsyncd server in Fortinet FortiWLC 6.1-2-29 and earlier, 7.0-9-1, 7.0-10-0, 8.0-5-0, 8.1-2-0, and 8.2-4-0 has a hardcoded rsync account, which allows remote attackers to read or write to arbitrary files via unspecified vectors.",CVE-2024-7560,"The News Flash theme for WordPress is vulnerable to PHP Object Injection in all versions up to, and including, 1.1.0 via deserialization of untrusted input from the newsflash_post_meta meta value. This makes it possible for authenticated attackers, with Editor-level access and above, to inject a PHP Object. No known POP chain is present in the vulnerable software. If a POP chain is present via an additional plugin or theme installed on the target system, it could allow the attacker to delete arbitrary files, retrieve sensitive data, or execute code.",TRUE
2016,CVE-2016-6496,9.8,"The LDAP directory connector in Atlassian Crowd before 2.8.8 and 2.9.x before 2.9.5 allows remote attackers to execute arbitrary code via an LDAP attribute with a crafted serialized Java object, aka LDAP entry poisoning.",CVE-2024-6496,"The Light Poll WordPress plugin through 1.0.0 does not have CSRF checks when deleting polls, which could allow attackers to make logged in users perform such action via a CSRF attack",TRUE
2016,CVE-2016-6138,9.8,"Directory traversal vulnerability in SAP TREX 7.10 Revision 63 allows remote attackers to read arbitrary files via unspecified vectors, aka SAP Security Note 2203591.",CVE-2024-6138,"The Secure Copy Content Protection and Content Locking WordPress plugin before 4.0.9 does not sanitise and escape some of its settings, which could allow high privilege users such as admin to perform Stored Cross-Site Scripting attacks even when the unfiltered_html capability is disallowed (for example in multisite setup).",TRUE
2016,CVE-2016-2196,9.8,Heap-based buffer overflow in the P-521 reduction function in Botan 1.11.x before 1.11.27 allows remote attackers to cause a denial of service (memory overwrite and crash) or execute arbitrary code via unspecified vectors.,CVE-2024-2196,"aimhubio/aim is vulnerable to Cross-Site Request Forgery (CSRF), allowing attackers to perform actions such as deleting runs, updating data, and stealing data like log records and notes without the user's consent. The vulnerability stems from the lack of CSRF and CORS protection in the aim dashboard. An attacker can exploit this by tricking a user into executing a malicious script that sends unauthorized requests to the aim server, leading to potential data loss and unauthorized data manipulation.",TRUE
2016,CVE-2016-8378,9.8,An issue was discovered in Lynxspring JENEsys BAS Bridge versions 1.1.8 and older. The application's database lacks sufficient safeguards for protecting credentials.,CVE-2024-8378,"The Safe SVG WordPress plugin before 2.2.6 has its sanitisation code is only running for paths that call wp_handle_upload, but not for example for code that uses wp_handle_sideload which is often used to upload attachments via raw POST data.",TRUE
2016,CVE-2016-2177,9.8,"OpenSSL through 1.0.2h incorrectly uses pointer arithmetic for heap-buffer boundary checks, which might allow remote attackers to cause a denial of service (integer overflow and application crash) or possibly have unspecified other impact by leveraging unexpected malloc behavior, related to s3_srvr.c, ssl_sess.c, and t1_lib.c.",CVE-2024-2177,"A Cross Window Forgery vulnerability exists within GitLab CE/EE affecting all versions from 16.3 prior to 16.11.5, 17.0 prior to 17.0.3, and 17.1 prior to 17.1.1. This condition allows for an attacker to abuse the OAuth authentication flow via a crafted payload.",TRUE
2016,CVE-2016-3690,9.8,The PooledInvokerServlet in JBoss EAP 4.x and 5.x allows remote attackers to execute arbitrary code via a crafted serialized payload.,CVE-2024-3690,A vulnerability classified as critical was found in PHPGurukul Small CRM 3.0. Affected by this vulnerability is an unknown functionality of the component Change Password Handler. The manipulation leads to sql injection. The attack can be launched remotely. The exploit has been disclosed to the public and may be used. The associated identifier of this vulnerability is VDB-260479.,TRUE
2016,CVE-2016-3493,9.8,"Unspecified vulnerability in the Hyperion Financial Reporting component in Oracle Hyperion 11.1.2.4 allows remote attackers to affect confidentiality, integrity, and availability via vectors related to Security Models.",CVE-2024-3493,"A specific malformed fragmented packet type (fragmented packets may be generated automatically by devices that send large amounts of data) can cause a major nonrecoverable fault (MNRF) Rockwell Automation's ControlLogix 5580, Guard Logix 5580, CompactLogix 5380, and 1756-EN4TR. If exploited, the affected product will become unavailable and require a manual restart to recover it. Additionally, an MNRF could result in a loss of view and/or control of connected devices. ",TRUE
2016,CVE-2016-4366,9.8,"HPE Systems Insight Manager (SIM) before 7.5.1 allows remote attackers to obtain sensitive information, modify data, or cause a denial of service via unspecified vectors.",CVE-2024-4366,"The Spectra – WordPress Gutenberg Blocks plugin for WordPress is vulnerable to Stored Cross-Site Scripting via the ‘block_id’ parameter in versions up to, and including, 2.13.0 due to insufficient input sanitization and output escaping. This makes it possible for authenticated attackers, with author-level permissions and above, to inject arbitrary web scripts in pages that will execute whenever a user accesses an injected page.",TRUE
2016,CVE-2016-4092,9.8,"Heap-based buffer overflow in Adobe Reader and Acrobat before 11.0.16, Acrobat and Acrobat Reader DC Classic before 15.006.30172, and Acrobat and Acrobat Reader DC Continuous before 15.016.20039 on Windows and OS X allows attackers to execute arbitrary code via unspecified vectors, a different vulnerability than CVE-2016-4091.",CVE-2024-4092,"The Slider Revolution plugin for WordPress is vulnerable to Stored Cross-Site Scripting via the ‘htmltag’ parameter in all versions up to, and including, 6.7.7 due to insufficient input sanitization and output escaping. This makes it possible for authenticated attackers to inject arbitrary web scripts in pages that will execute whenever a user accesses an injected page. By default, this can only be exploited by administrators, but the ability to use and configure Slider Revolution can be extended to authors.",TRUE
2016,CVE-2016-1044,10,"Adobe Reader and Acrobat before 11.0.16, Acrobat and Acrobat Reader DC Classic before 15.006.30172, and Acrobat and Acrobat Reader DC Continuous before 15.016.20039 on Windows and OS X allow attackers to bypass JavaScript API execution restrictions via unspecified vectors, a different vulnerability than CVE-2016-1038, CVE-2016-1039, CVE-2016-1040, CVE-2016-1041, CVE-2016-1042, CVE-2016-1062, and CVE-2016-1117.",CVE-2024-1044,"The Customer Reviews for WooCommerce plugin for WordPress is vulnerable to unauthorized modification of data due to a missing capability check on the 'submit_review' function in all versions up to, and including, 5.38.12. This makes it possible for unauthenticated attackers to submit reviews with arbitrary email addresses regardless of whether reviews are globally enabled.",TRUE
2016,CVE-2016-1042,9.8,"Adobe Reader and Acrobat before 11.0.16, Acrobat and Acrobat Reader DC Classic before 15.006.30172, and Acrobat and Acrobat Reader DC Continuous before 15.016.20039 on Windows and OS X allow attackers to bypass JavaScript API execution restrictions via unspecified vectors, a different vulnerability than CVE-2016-1038, CVE-2016-1039, CVE-2016-1040, CVE-2016-1041, CVE-2016-1044, CVE-2016-1062, and CVE-2016-1117.",CVE-2024-1042,"The WP Radio – Worldwide Online Radio Stations Directory for WordPress plugin for WordPress is vulnerable to unauthorized modification of data due to a missing capability check on multiple AJAX functions in all versions up to, and including, 3.1.9. This makes it possible for authenticated attackers, with subscriber access and above, to import radio stations, remove countries, and modify the plugin's settings, which can lead to Cross-Site Scripting, tracked separately in CVE-2024-1041.",TRUE
2016,CVE-2016-5841,9.8,Integer overflow in MagickCore/profile.c in ImageMagick before 7.0.2-1 allows remote attackers to cause a denial of service (segmentation fault) or possibly execute arbitrary code via vectors involving the offset variable.,CVE-2024-5841,Use after free in V8 in Google Chrome prior to 126.0.6478.54 allowed a remote attacker to potentially exploit heap corruption via a crafted HTML page. (Chromium security severity: Medium),TRUE
